<?xml version="1.0" encoding="UTF-8"?>
<Shop xsi:noNamespaceSchemaLocation="xmlshop.xsd" xmlns:xsi="http://www.w3.org/2001/XMLSchema-instance">
	<Books>
		<Book ID="BOOK_ID_1">
			<Title>Twilight</Title>
			<Year>2007</Year>
			<Price>5.80</Price>
			<Distributor>COMP_ID_8</Distributor>
			<Genre>Fantasy</Genre>
			<Authors>
				<Author>PERS_ID_19</Author>
			</Authors>
		</Book>
		<Book ID="BOOK_ID_2">
			<Title>New Moon</Title>
			<Year>2007</Year>
			<Price>7.00</Price>
			<Distributor>COMP_ID_8</Distributor>
			<Genre>Fantasy</Genre>
			<Authors>
				<Author>PERS_ID_19</Author>
			</Authors>
		</Book>
		<Book ID="BOOK_ID_3">
			<Title>Eclipse</Title>
			<Year>2049</Year>
			<Price>7.95</Price>
			<Distributor>COMP_ID_8</Distributor>
			<Genre>Fantasy</Genre>
			<Authors>
				<Author>PERS_ID_19</Author>
			</Authors>
		</Book>
		<Book ID="BOOK_ID_4">
			<Title>Breaking Dawn</Title>
			<Year>2008</Year>
			<Price>9.91</Price>
			<Distributor>COMP_ID_8</Distributor>
			<Genre>Fantasy</Genre>
			<Authors>
				<Author>PERS_ID_19</Author>
			</Authors>
		</Book>
		<Book ID="BOOK_ID_5">
			<Title>The Book Thief</Title>
			<Year>2007</Year>
			<Price>5.95</Price>
			<Distributor>COMP_ID_9</Distributor>
			<Genre>Fantasy</Genre>
			<Authors>
				<Author>PERS_ID_20</Author>
			</Authors>
		</Book>
		<Book ID="BOOK_ID_6">
			<Title>Angels and Demons</Title>
			<Year>2003</Year>
			<Price>8.60</Price>
			<Distributor>COMP_ID_14</Distributor>
			<Genre>Crime</Genre>
			<Authors>
				<Author>PERS_ID_40</Author>
			</Authors>
		</Book>
		<Book ID="BOOK_ID_7">
			<Title>Deception Point</Title>
			<Year>2004</Year>
			<Price>9.30</Price>
			<Distributor>COMP_ID_14</Distributor>
			<Genre>Crime</Genre>
			<Authors>
				<Author>PERS_ID_40</Author>
			</Authors>
		</Book>
		<Book ID="BOOK_ID_8">
			<Title>The Da Vinci Code</Title>
			<Year>2004</Year>
			<Price>8.95</Price>
			<Distributor>COMP_ID_14</Distributor>
			<Genre>Crime</Genre>
			<Authors>
				<Author>PERS_ID_40</Author>
			</Authors>
		</Book>
		<Book ID="BOOK_ID_9">
			<Title>Digital Fortress</Title>
			<Year>2004</Year>
			<Price>9.00</Price>
			<Distributor>COMP_ID_14</Distributor>
			<Genre>Crime</Genre>
			<Authors>
				<Author>PERS_ID_40</Author>
			</Authors>
		</Book>
		<Book ID="BOOK_ID_10">
			<Title>The Lost Symbol</Title>
			<Year>2009</Year>
			<Price>19.95</Price>
			<Distributor>COMP_ID_14</Distributor>
			<Genre>Crime</Genre>
			<Authors>
				<Author>PERS_ID_40</Author>
			</Authors>
		</Book>
		<Book ID="BOOK_ID_11">
			<Title>Die Welt ist nicht immer Freitag</Title>
			<Year>2006</Year>
			<Price>7.95</Price>
			<Distributor>COMP_ID_17</Distributor>
			<Genre>Humour</Genre>
			<Authors>
				<Author>PERS_ID_54</Author>
            </Authors>
        </Book>
		<Book ID="BOOK_ID_12">
			<Title>Gut gegen Nordwind</Title>
			<Year>2008</Year>
			<Price>7.95</Price>
			<Distributor>COMP_ID_18</Distributor>
			<Genre>Fiction</Genre>
			<Authors>
				<Author>PERS_ID_25</Author>
            </Authors>
        </Book>
		<Book ID="BOOK_ID_13">
			<Title>Denken Sie selbst! Sonst tun es andere für Sie</Title>
			<Year>2008</Year>
			<Price>9.95</Price>
			<Distributor>COMP_ID_17</Distributor>
			<Genre>Humour</Genre>
			<Authors>
				<Author>PERS_ID_56</Author>
            </Authors>
        </Book>
		<Book ID="BOOK_ID_14">
			<Title>Die Leber wächst mit ihren Aufgaben. Kurioses aus der Medizin</Title>
			<Year>2008</Year>
			<Price>9.95</Price>
			<Distributor>COMP_ID_17</Distributor>
			<Genre>Humour</Genre>
			<Authors>
				<Author>PERS_ID_57</Author>
            </Authors>
        </Book>
		<Book ID="BOOK_ID_15">
			<Title>Aufzeichnungen eines Schnitzeljägers: Mit Geocaching zurück zur Natur</Title>
			<Year>2007</Year>
			<Price>9.90</Price>
			<Distributor>COMP_ID_17</Distributor>
			<Genre>Humour</Genre>
			<Authors>
				<Author>PERS_ID_58</Author>
            </Authors>
        </Book>
		<Book ID="BOOK_ID_16">
			<Title>Smørrebrød in Napoli: Ein vergnüglicher Streifzug durch Europa</Title>
			<Year>2009</Year>
			<Price>8.95</Price>
			<Distributor>COMP_ID_17</Distributor>
			<Genre>Travel</Genre>
			<Authors>
				<Author>PERS_ID_59</Author>
            </Authors>
        </Book>
		<Book ID="BOOK_ID_17">
			<Title>Glück kommt selten allein...</Title>
			<Year>2009</Year>
			<Price>18.95</Price>
			<Distributor>COMP_ID_17</Distributor>
			<Genre>Humour</Genre>
			<Authors>
				<Author>PERS_ID_57</Author>
            </Authors>
        </Book>
		<Book ID="BOOK_ID_18">
			<Title>Gibt es intelligentes Leben?</Title>
			<Year>2006</Year>
			<Price>9.95</Price>
			<Distributor>COMP_ID_17</Distributor>
			<Genre>Humour</Genre>
			<Authors>
				<Author>PERS_ID_60</Author>
            </Authors>
        </Book>
		<Book ID="BOOK_ID_19">
			<Title>Wer's glaubt, wird selig</Title>
			<Year>2007</Year>
			<Price>9.90</Price>
			<Distributor>COMP_ID_17</Distributor>
			<Genre>Humour</Genre>
			<Authors>
				<Author>PERS_ID_60</Author>
            </Authors>
        </Book>
		<Book ID="BOOK_ID_20">
			<Title>Vollidiot</Title>
			<Year>2006</Year>
			<Price>7.95</Price>
			<Distributor>COMP_ID_19</Distributor>
			<Genre>Humour</Genre>
			<Authors>
				<Author>PERS_ID_61</Author>
            </Authors>
        </Book>
		<Book ID="BOOK_ID_21">
			<Title>Resturlaub</Title>
			<Year>2007</Year>
			<Price>7.95</Price>
			<Distributor>COMP_ID_19</Distributor>
			<Genre>Humour</Genre>
			<Authors>
				<Author>PERS_ID_61</Author>
            </Authors>
        </Book>
		<Book ID="BOOK_ID_22">
			<Title>Millionär: Der Roman</Title>
			<Year>2008</Year>
			<Price>8.95</Price>
			<Distributor>COMP_ID_19</Distributor>
			<Genre>Humour</Genre>
			<Authors>
				<Author>PERS_ID_61</Author>
            </Authors>
        </Book>
	</Books>
	<CDs>
		<CD ID="CD_ID_1">
			<Title>21st Century Breakdown</Title>
			<Year>2009</Year>
			<Price>13.95</Price>
			<Distributor>COMP_ID_3</Distributor>
			<Genre>Indie</Genre>
			<Band>
				<Name>Green Day</Name>
				<Member>PERS_ID_1</Member>
				<Member>PERS_ID_2</Member>
				<Member>PERS_ID_3</Member>
			</Band>
		</CD>
		<CD ID="CD_ID_2">
			<Title>Mtv Unplugged in New York</Title>
			<Year>2009</Year>
			<Price>17.95</Price>
			<Distributor>COMP_ID_4</Distributor>
			<Genre>Rock</Genre>
			<Band>
				<Name>Sportfreunde Stiller</Name>
				<Member>PERS_ID_4</Member>
				<Member>PERS_ID_5</Member>
				<Member>PERS_ID_6</Member>
			</Band>
		</CD>
		<CD ID="CD_ID_3">
			<Title>American Idiot</Title>
			<Year>2004</Year>
			<Price>8.95</Price>
			<Distributor>COMP_ID_3</Distributor>
			<Genre>Indie</Genre>
			<Band>
				<Name>Green Day</Name>
				<Member>PERS_ID_1</Member>
				<Member>PERS_ID_2</Member>
				<Member>PERS_ID_3</Member>
			</Band>
		</CD>
		<CD ID="CD_ID_4">
			<Title>1</Title>
			<Year>2000</Year>
			<Price>11.95</Price>
			<Distributor>COMP_ID_5</Distributor>
			<Genre>Rock</Genre>
			<Band>
				<Name>the Beatles</Name>
				<Member>PERS_ID_7</Member>
				<Member>PERS_ID_8</Member>
				<Member>PERS_ID_9</Member>
				<Member>PERS_ID_10</Member>
			</Band>
		</CD>
		<CD ID="CD_ID_5">
			<Title>Stadtaffe</Title>
			<Year>2009</Year>
			<Price>13.97</Price>
			<Distributor>COMP_ID_10</Distributor>
			<Genre>Hip_Hop</Genre>
			<Soloartist>PERS_ID_21</Soloartist>
		</CD>
		<CD ID="CD_ID_6">
			<Title>Foot of the Mountain</Title>
			<Year>2009</Year>
			<Price>14.95</Price>
			<Distributor>COMP_ID_11</Distributor>
			<Genre>Pop</Genre>
			<Band>
				<Name>Placebo</Name>
				<Member>PERS_ID_25</Member>
			</Band>
		</CD>
		<CD ID="CD_ID_7">
			<Title>Battle for the Sun</Title>
			<Year>2009</Year>
			<Price>13.95</Price>
			<Distributor>COMP_ID_12</Distributor>
			<Genre>Rock</Genre>
			<Band>
				<Name>Placebo</Name>
				<Member>PERS_ID_25</Member>
				<Member>PERS_ID_26</Member>
				<Member>PERS_ID_27</Member>
			</Band>
		</CD>
		<CD ID="CD_ID_8">
			<Title>Do or Die</Title>
			<Year>2009</Year>
			<Price>12.95</Price>
			<Distributor>COMP_ID_11</Distributor>
			<Genre>Rock</Genre>
			<Band>
				<Name>The Bosshoss</Name>
				<Member>PERS_ID_28</Member>
				<Member>PERS_ID_29</Member>
				<Member>PERS_ID_30</Member>
				<Member>PERS_ID_31</Member>
				<Member>PERS_ID_32</Member>
				<Member>PERS_ID_33</Member>
				<Member>PERS_ID_34</Member>
			</Band>
		</CD>
		<CD ID="CD_ID_9">
			<Title>Next!</Title>
			<Year>2005</Year>
			<Price>18.95</Price>
			<Distributor>COMP_ID_10</Distributor>
			<Genre>Reggae</Genre>
			<Band>
				<Name>Seeed</Name>
				<Member>PERS_ID_21</Member>
				<Member>PERS_ID_35</Member>
				<Member>PERS_ID_36</Member>
			</Band>
		</CD>
		<CD ID="CD_ID_10">
			<Title>Let It Roll: Songs Of George Harrison</Title>
			<Year>2009</Year>
			<Price>15.95</Price>
			<Distributor>COMP_ID_6</Distributor>
			<Genre>Rock</Genre>
			<Soloartist>PERS_ID_9</Soloartist>
		</CD>
		<CD ID="CD_ID_11">
			<Title>Jazz ist anders</Title>
			<Year>2007</Year>
			<Price>14.95</Price>
			<Distributor>COMP_ID_11</Distributor>
			<Genre>Rock</Genre>
			<Band>
				<Name>Die Ärzte</Name>
				<Member>PERS_ID_37</Member>
				<Member>PERS_ID_38</Member>
				<Member>PERS_ID_39</Member>
			</Band>
		</CD>
		<CD ID="CD_ID_12">
			<Title>Unplugged - Rock'n'Roll Realschule</Title>
			<Year>2002</Year>
			<Price>17.95</Price>
			<Distributor>COMP_ID_11</Distributor>
			<Genre>Rock</Genre>
			<Band>
				<Name>Die Ärzte</Name>
				<Member>PERS_ID_37</Member>
				<Member>PERS_ID_38</Member>
				<Member>PERS_ID_39</Member>
			</Band>
		</CD>
		<CD ID="CD_ID_13">
			<Title>Geräusch</Title>
			<Year>2003</Year>
			<Price>21.95</Price>
			<Distributor>COMP_ID_11</Distributor>
			<Genre>Rock</Genre>
			<Band>
				<Name>Die Ärzte</Name>
				<Member>PERS_ID_37</Member>
				<Member>PERS_ID_38</Member>
				<Member>PERS_ID_39</Member>
			</Band>
		</CD>
		<CD ID="CD_ID_14">
			<Title>13</Title>
			<Year>1995</Year>
			<Price>18.95</Price>
			<Distributor>COMP_ID_11</Distributor>
			<Genre>Rock</Genre>
			<Band>
				<Name>Die Ärzte</Name>